id,title,overview,poster_path,release_date,runtime,vote_average,genres,backdrop_path,tagline,status,budget,revenue,homepage,popularity,vote_count,Director,Star1,Star2,Star3,Star4,certificate
212,Ôkami kodomo no Ame to Yuki,"After her werewolf lover unexpectedly dies in an accident while hunting for food for their children, a young woman must find ways to raise the werewolf son and daughter that she had with him while keeping their trait hidden from society.","https://m.media-amazon.com/images/M/MV5BYzQxNDZhNDUtNDUwOC00NjQyLTg2OWUtZWVlYThjYjYyMTc2XkEyXkFqcGdeQXVyNTAyODkwOQ@@._V1_UY98_CR1,0,67,98_AL_.jpg",2012,117 min,8.1,"[{'name': 'Animation'}, {'name': 'Drama'}, {'name': 'Fantasy'}]",,,,0,,,71.0,38803,Mamoru Hosoda,Aoi Miyazaki,Takao Osawa,Haru Kuroki,Yukito Nishii,U
213,Hacksaw Ridge,"World War II American Army Medic Desmond T. Doss, who served during the Battle of Okinawa, refuses to kill people, and becomes the first man in American history to receive the Medal of Honor without firing a shot.","https://m.media-amazon.com/images/M/MV5BMjQ1NjM3MTUxNV5BMl5BanBnXkFtZTgwMDc5MTY5OTE@._V1_UX67_CR0,0,67,98_AL_.jpg",2016,139 min,8.1,"[{'name': 'Biography'}, {'name': 'Drama'}, {'name': 'History'}]",,,,0,"67,209,615",,71.0,435928,Mel Gibson,Andrew Garfield,Sam Worthington,Luke Bracey,Teresa Palmer,A
214,Inside Out,"After young Riley is uprooted from her Midwest life and moved to San Francisco, her emotions - Joy, Fear, Anger, Disgust and Sadness - conflict on how best to navigate a new city, house, and school.","https://m.media-amazon.com/images/M/MV5BOTgxMDQwMDk0OF5BMl5BanBnXkFtZTgwNjU5OTg2NDE@._V1_UX67_CR0,0,67,98_AL_.jpg",2015,95 min,8.1,"[{'name': 'Animation'}, {'name': 'Adventure'}, {'name': 'Comedy'}]",,,,0,"356,461,711",,94.0,616228,Pete Docter,Ronnie Del Carmen,Amy Poehler,Bill Hader,Lewis Black,U
215,Barfi!,Three young people learn that love can neither be defined nor contained by society's definition of normal and abnormal.,"https://m.media-amazon.com/images/M/MV5BMTQzMTEyODY2Ml5BMl5BanBnXkFtZTgwMjA0MDUyMjE@._V1_UY98_CR0,0,67,98_AL_.jpg",2012,151 min,8.1,"[{'name': 'Comedy'}, {'name': 'Drama'}, {'name': 'Romance'}]",,,,0,"2,804,874",,,75721,Anurag Basu,Ranbir Kapoor,Priyanka Chopra,Ileana D'Cruz,Saurabh Shukla,U
216,12 Years a Slave,"In the antebellum United States, Solomon Northup, a free black man from upstate New York, is abducted and sold into slavery.","https://m.media-amazon.com/images/M/MV5BMjExMTEzODkyN15BMl5BanBnXkFtZTcwNTU4NTc4OQ@@._V1_UX67_CR0,0,67,98_AL_.jpg",2013,134 min,8.1,"[{'name': 'Biography'}, {'name': 'Drama'}, {'name': 'History'}]",,,,0,"56,671,993",,96.0,640533,Steve McQueen,Chiwetel Ejiofor,Michael Kenneth Williams,Michael Fassbender,Brad Pitt,A
217,Rush,The merciless 1970s rivalry between Formula One rivals James Hunt and Niki Lauda.,"https://m.media-amazon.com/images/M/MV5BOWEwODJmZDItYTNmZC00OGM4LThlNDktOTQzZjIzMGQxODA4XkEyXkFqcGdeQXVyNjU0OTQ0OTY@._V1_UX67_CR0,0,67,98_AL_.jpg",2013,123 min,8.1,"[{'name': 'Action'}, {'name': 'Biography'}, {'name': 'Drama'}]",,,,0,"26,947,624",,74.0,432811,Ron Howard,Daniel Brühl,Chris Hemsworth,Olivia Wilde,Alexandra Maria Lara,UA
218,Ford v Ferrari,American car designer Carroll Shelby and driver Ken Miles battle corporate interference and the laws of physics to build a revolutionary race car for Ford in order to defeat Ferrari at the 24 Hours of Le Mans in 1966.,"https://m.media-amazon.com/images/M/MV5BM2UwMDVmMDItM2I2Yi00NGZmLTk4ZTUtY2JjNTQ3OGQ5ZjM2XkEyXkFqcGdeQXVyMTA1OTYzOTUx._V1_UX67_CR0,0,67,98_AL_.jpg",2019,152 min,8.1,"[{'name': 'Action'}, {'name': 'Biography'}, {'name': 'Drama'}]",,,,0,"117,624,028",,81.0,291289,James Mangold,Matt Damon,Christian Bale,Jon Bernthal,Caitriona Balfe,UA
219,Spotlight,"The true story of how the Boston Globe uncovered the massive scandal of child molestation and cover-up within the local Catholic Archdiocese, shaking the entire Catholic Church to its core.","https://m.media-amazon.com/images/M/MV5BMjIyOTM5OTIzNV5BMl5BanBnXkFtZTgwMDkzODE2NjE@._V1_UX67_CR0,0,67,98_AL_.jpg",2015,129 min,8.1,"[{'name': 'Biography'}, {'name': 'Crime'}, {'name': 'Drama'}]",,,,0,"45,055,776",,93.0,420316,Tom McCarthy,Mark Ruffalo,Michael Keaton,Rachel McAdams,Liev Schreiber,A
220,Song of the Sea,"Ben, a young Irish boy, and his little sister Saoirse, a girl who can turn into a seal, go on an adventure to free the fairies and save the spirit world.","https://m.media-amazon.com/images/M/MV5BMTQ2MDMwNjEwNV5BMl5BanBnXkFtZTgwOTkxMzI0MzE@._V1_UY98_CR0,0,67,98_AL_.jpg",2014,93 min,8.1,"[{'name': 'Animation'}, {'name': 'Adventure'}, {'name': 'Drama'}]",,,,0,"857,524",,85.0,51679,Tomm Moore,David Rawle,Brendan Gleeson,Lisa Hannigan,Fionnula Flanagan,PG
221,Kahaani,"A pregnant woman's search for her missing husband takes her from London to Kolkata, but everyone she questions denies having ever met him.","https://m.media-amazon.com/images/M/MV5BMTQ1NDI0NzkyOF5BMl5BanBnXkFtZTcwNzAyNzE2Nw@@._V1_UY98_CR0,0,67,98_AL_.jpg",2012,122 min,8.1,"[{'name': 'Mystery'}, {'name': 'Thriller'}]",,,,0,"1,035,953",,,57806,Sujoy Ghosh,Vidya Balan,Parambrata Chattopadhyay,Indraneil Sengupta,Nawazuddin Siddiqui,UA
222,Zindagi Na Milegi Dobara,Three friends decide to turn their fantasy vacation into reality after one of their friends gets engaged.,"https://m.media-amazon.com/images/M/MV5BZGFmMjM5OWMtZTRiNC00ODhlLThlYTItYTcyZDMyYmMyYjFjXkEyXkFqcGdeQXVyNDUzOTQ5MjY@._V1_UY98_CR0,0,67,98_AL_.jpg",2011,155 min,8.1,"[{'name': 'Comedy'}, {'name': 'Drama'}]",,,,0,"3,108,485",,,67927,Zoya Akhtar,Hrithik Roshan,Farhan Akhtar,Abhay Deol,Katrina Kaif,U
223,Prisoners,"When Keller Dover's daughter and her friend go missing, he takes matters into his own hands as the police pursue multiple leads and the pressure mounts.","https://m.media-amazon.com/images/M/MV5BMTg0NTIzMjQ1NV5BMl5BanBnXkFtZTcwNDc3MzM5OQ@@._V1_UX67_CR0,0,67,98_AL_.jpg",2013,153 min,8.1,"[{'name': 'Crime'}, {'name': 'Drama'}, {'name': 'Mystery'}]",,,,0,"61,002,302",,70.0,601149,Denis Villeneuve,Hugh Jackman,Jake Gyllenhaal,Viola Davis,Melissa Leo,A
224,Mad Max: Fury Road,"In a post-apocalyptic wasteland, a woman rebels against a tyrannical ruler in search for her homeland with the aid of a group of female prisoners, a psychotic worshiper, and a drifter named Max.","https://m.media-amazon.com/images/M/MV5BN2EwM2I5OWMtMGQyMi00Zjg1LWJkNTctZTdjYTA4OGUwZjMyXkEyXkFqcGdeQXVyMTMxODk2OTU@._V1_UX67_CR0,0,67,98_AL_.jpg",2015,120 min,8.1,"[{'name': 'Action'}, {'name': 'Adventure'}, {'name': 'Sci-Fi'}]",,,,0,"154,058,340",,90.0,882316,George Miller,Tom Hardy,Charlize Theron,Nicholas Hoult,Zoë Kravitz,UA
225,A Wednesday,A retiring police officer reminisces about the most astounding day of his career. About a case that was never filed but continues to haunt him in his memories - the case of a man and a Wednesday.,"https://m.media-amazon.com/images/M/MV5BOTcwMzdiMWItMjZlOS00MzAzLTg5OTItNTA4OGYyMjBhMmRiXkEyXkFqcGdeQXVyODE5NzE3OTE@._V1_UY98_CR1,0,67,98_AL_.jpg",2008,104 min,8.1,"[{'name': 'Action'}, {'name': 'Crime'}, {'name': 'Drama'}]",,,,0,,,,73891,Neeraj Pandey,Anupam Kher,Naseeruddin Shah,Jimmy Sheirgill,Aamir Bashir,UA
226,Gran Torino,"Disgruntled Korean War veteran Walt Kowalski sets out to reform his neighbor, Thao Lor, a Hmong teenager who tried to steal Kowalski's prized possession: a 1972 Gran Torino.","https://m.media-amazon.com/images/M/MV5BMTc5NTk2OTU1Nl5BMl5BanBnXkFtZTcwMDc3NjAwMg@@._V1_UX67_CR0,0,67,98_AL_.jpg",2008,116 min,8.1,[{'name': 'Drama'}],,,,0,"148,095,302",,72.0,720450,Clint Eastwood,Clint Eastwood,Bee Vang,Christopher Carley,Ahney Her,R
227,Harry Potter and the Deathly Hallows: Part 2,"Harry, Ron, and Hermione search for Voldemort's remaining Horcruxes in their effort to destroy the Dark Lord as the final battle rages on at Hogwarts.","https://m.media-amazon.com/images/M/MV5BMGVmMWNiMDktYjQ0Mi00MWIxLTk0N2UtN2ZlYTdkN2IzNDNlXkEyXkFqcGdeQXVyODE5NzE3OTE@._V1_UX67_CR0,0,67,98_AL_.jpg",2011,130 min,8.1,"[{'name': 'Adventure'}, {'name': 'Drama'}, {'name': 'Fantasy'}]",,,,0,"381,011,219",,85.0,764493,David Yates,Daniel Radcliffe,Emma Watson,Rupert Grint,Michael Gambon,UA
228,Okuribito,A newly unemployed cellist takes a job preparing the dead for funerals.,"https://m.media-amazon.com/images/M/MV5BMTUzOTcwOTA2NV5BMl5BanBnXkFtZTcwNDczMzczMg@@._V1_UY98_CR0,0,67,98_AL_.jpg",2008,130 min,8.1,"[{'name': 'Drama'}, {'name': 'Music'}]",,,,0,"1,498,210",,68.0,48582,Yôjirô Takita,Masahiro Motoki,Ryôko Hirosue,Tsutomu Yamazaki,Kazuko Yoshiyuki,PG-13
229,Hachi: A Dog's Tale,A college professor bonds with an abandoned dog he takes into his home.,"https://m.media-amazon.com/images/M/MV5BNzE4NDg5OWMtMzg3NC00ZDRjLTllMDMtZTRjNWZmNjBmMGZlXkEyXkFqcGdeQXVyMTMxODk2OTU@._V1_UY98_CR1,0,67,98_AL_.jpg",2009,93 min,8.1,"[{'name': 'Biography'}, {'name': 'Drama'}, {'name': 'Family'}]",,,,0,,,,253575,Lasse Hallström,Richard Gere,Joan Allen,Cary-Hiroyuki Tagawa,Sarah Roemer,G
230,Mary and Max,"A tale of friendship between two unlikely pen pals: Mary, a lonely, eight-year-old girl living in the suburbs of Melbourne, and Max, a forty-four-year old, severely obese man living in New York.","https://m.media-amazon.com/images/M/MV5BMDgzYjQwMDMtNGUzYi00MTRmLWIyMGMtNjE1OGZkNzY2YWIzL2ltYWdlXkEyXkFqcGdeQXVyNjU0OTQ0OTY@._V1_UY98_CR1,0,67,98_AL_.jpg",2009,92 min,8.1,"[{'name': 'Animation'}, {'name': 'Comedy'}, {'name': 'Drama'}]",,,,0,,,,164462,Adam Elliot,Toni Collette,Philip Seymour Hoffman,Eric Bana,Barry Humphries,
231,How to Train Your Dragon,"A hapless young Viking who aspires to hunt dragons becomes the unlikely friend of a young dragon himself, and learns there may be more to the creatures than he assumed.","https://m.media-amazon.com/images/M/MV5BMjA5NDQyMjc2NF5BMl5BanBnXkFtZTcwMjg5ODcyMw@@._V1_UX67_CR0,0,67,98_AL_.jpg",2010,98 min,8.1,"[{'name': 'Animation'}, {'name': 'Action'}, {'name': 'Adventure'}]",,,,0,"217,581,231",,75.0,666773,Dean DeBlois,Chris Sanders,Jay Baruchel,Gerard Butler,Christopher Mintz-Plasse,U
232,Into the Wild,"After graduating from Emory University, top student and athlete Christopher McCandless abandons his possessions, gives his entire $24,000 savings account to charity and hitchhikes to Alaska to live in the wilderness. Along the way, Christopher encounters a series of characters that shape his life.","https://m.media-amazon.com/images/M/MV5BMTAwNDEyODU1MjheQTJeQWpwZ15BbWU2MDc3NDQwNw@@._V1_UX67_CR0,0,67,98_AL_.jpg",2007,148 min,8.1,"[{'name': 'Adventure'}, {'name': 'Biography'}, {'name': 'Drama'}]",,,,0,"18,354,356",,73.0,572921,Sean Penn,Emile Hirsch,Vince Vaughn,Catherine Keener,Marcia Gay Harden,R
233,No Country for Old Men,Violence and mayhem ensue after a hunter stumbles upon a drug deal gone wrong and more than two million dollars in cash near the Rio Grande.,"https://m.media-amazon.com/images/M/MV5BMjA5Njk3MjM4OV5BMl5BanBnXkFtZTcwMTc5MTE1MQ@@._V1_UX67_CR0,0,67,98_AL_.jpg",2007,122 min,8.1,"[{'name': 'Crime'}, {'name': 'Drama'}, {'name': 'Thriller'}]",,,,0,"74,283,625",,91.0,856916,Ethan Coen,Joel Coen,Tommy Lee Jones,Javier Bardem,Josh Brolin,R
234,Lage Raho Munna Bhai,Munna Bhai embarks on a journey with Mahatma Gandhi in order to fight against a corrupt property dealer.,"https://m.media-amazon.com/images/M/MV5BN2ZmMDMwODgtMzA5MS00MGU0LWEyYTgtYzQ5MmQzMzU2NTVkXkEyXkFqcGdeQXVyODE5NzE3OTE@._V1_UY98_CR0,0,67,98_AL_.jpg",2006,144 min,8.1,"[{'name': 'Comedy'}, {'name': 'Drama'}, {'name': 'Romance'}]",,,,0,"2,217,561",,,43137,Rajkumar Hirani,Sanjay Dutt,Arshad Warsi,Vidya Balan,Boman Irani,U
235,Million Dollar Baby,A determined woman works with a hardened boxing trainer to become a professional.,"https://m.media-amazon.com/images/M/MV5BMTkxNzA1NDQxOV5BMl5BanBnXkFtZTcwNTkyMTIzMw@@._V1_UX67_CR0,0,67,98_AL_.jpg",2004,132 min,8.1,"[{'name': 'Drama'}, {'name': 'Sport'}]",,,,0,"100,492,203",,86.0,635975,Clint Eastwood,Hilary Swank,Clint Eastwood,Morgan Freeman,Jay Baruchel,UA
236,Hotel Rwanda,"Paul Rusesabagina, a hotel manager, houses over a thousand Tutsi refugees during their struggle against the Hutu militia in Rwanda, Africa.","https://m.media-amazon.com/images/M/MV5BZGJjYmIzZmQtNWE4Yy00ZGVmLWJkZGEtMzUzNmQ4ZWFlMjRhXkEyXkFqcGdeQXVyMTMxODk2OTU@._V1_UX67_CR0,0,67,98_AL_.jpg",2004,121 min,8.1,"[{'name': 'Biography'}, {'name': 'Drama'}, {'name': 'History'}]",,,,0,"23,530,892",,79.0,334320,Terry George,Don Cheadle,Sophie Okonedo,Joaquin Phoenix,Xolani Mali,PG-13
237,Taegukgi hwinalrimyeo,"When two brothers are forced to fight in the Korean War, the elder decides to take the riskiest missions if it will help shield the younger from battle.","https://m.media-amazon.com/images/M/MV5BNjAxZTEzNzQtYjdlNy00ZTJmLTkwZDUtOTAwNTM3YjI2MWUyL2ltYWdlXkEyXkFqcGdeQXVyNTAyODkwOQ@@._V1_UX67_CR0,0,67,98_AL_.jpg",2004,140 min,8.1,"[{'name': 'Action'}, {'name': 'Drama'}, {'name': 'War'}]",,,,0,"1,111,061",,64.0,37820,Je-kyu Kang,Jang Dong-Gun,Won Bin,Eun-ju Lee,Hyeong-jin Kong,R
238,Before Sunset,"Nine years after Jesse and Celine first met, they encounter each other again on the French leg of Jesse's book tour.","https://m.media-amazon.com/images/M/MV5BMTQ1MjAwNTM5Ml5BMl5BanBnXkFtZTYwNDM0MTc3._V1_UX67_CR0,0,67,98_AL_.jpg",2004,80 min,8.1,"[{'name': 'Drama'}, {'name': 'Romance'}]",,,,0,"5,820,649",,90.0,236311,Richard Linklater,Ethan Hawke,Julie Delpy,Vernon Dobtcheff,Louise Lemoine Torrès,R
239,Munna Bhai M.B.B.S.,A gangster sets out to fulfill his father's dream of becoming a doctor.,"https://m.media-amazon.com/images/M/MV5BMzQ4MTBlYTQtMzJkYS00OGNjLTk1MWYtNzQ0OTQ0OWEyOWU1XkEyXkFqcGdeQXVyNDgyODgxNjE@._V1_UY98_CR1,0,67,98_AL_.jpg",2003,156 min,8.1,"[{'name': 'Comedy'}, {'name': 'Drama'}, {'name': 'Musical'}]",,,,0,,,,73992,Rajkumar Hirani,Sanjay Dutt,Arshad Warsi,Gracy Singh,Sunil Dutt,U
240,Salinui chueok,"In a small Korean province in 1986, two detectives struggle with the case of multiple young women being found raped and murdered by an unknown culprit.","https://m.media-amazon.com/images/M/MV5BOGViNTg4YTktYTQ2Ni00MTU0LTk2NWUtMTI4OTc1YTM0NzQ2XkEyXkFqcGdeQXVyMDM2NDM2MQ@@._V1_UX67_CR0,0,67,98_AL_.jpg",2003,131 min,8.1,"[{'name': 'Crime'}, {'name': 'Drama'}, {'name': 'Mystery'}]",,,,0,"14,131",,82.0,139558,Bong Joon Ho,Kang-ho Song,Kim Sang-kyung,Roe-ha Kim,Jae-ho Song,UA
241,Dil Chahta Hai,"Three inseparable childhood friends are just out of college. Nothing comes between them - until they each fall in love, and their wildly different approaches to relationships creates tension.","https://m.media-amazon.com/images/M/MV5BMjRjMTYwMTYtMmRkNi00MmVkLWE0MjQtNmM3YjI0NWFhZDNmXkEyXkFqcGdeQXVyODE5NzE3OTE@._V1_UX67_CR0,0,67,98_AL_.jpg",2001,183 min,8.1,"[{'name': 'Comedy'}, {'name': 'Drama'}, {'name': 'Romance'}]",,,,0,"300,000",,,66803,Farhan Akhtar,Aamir Khan,Saif Ali Khan,Akshaye Khanna,Preity Zinta,Unrated
242,Kill Bill: Vol. 1,"After awakening from a four-year coma, a former assassin wreaks vengeance on the team of assassins who betrayed her.","https://m.media-amazon.com/images/M/MV5BNzM3NDFhYTAtYmU5Mi00NGRmLTljYjgtMDkyODQ4MjNkMGY2XkEyXkFqcGdeQXVyNzkwMjQ5NzM@._V1_UX67_CR0,0,67,98_AL_.jpg",2003,111 min,8.1,"[{'name': 'Action'}, {'name': 'Crime'}, {'name': 'Drama'}]",,,,0,"70,099,045",,69.0,1000639,Quentin Tarantino,Uma Thurman,David Carradine,Daryl Hannah,Michael Madsen,R
243,Finding Nemo,"After his son is captured in the Great Barrier Reef and taken to Sydney, a timid clownfish sets out on a journey to bring him home.","https://m.media-amazon.com/images/M/MV5BZTAzNWZlNmUtZDEzYi00ZjA5LWIwYjEtZGM1NWE1MjE4YWRhXkEyXkFqcGdeQXVyNjU0OTQ0OTY@._V1_UX67_CR0,0,67,98_AL_.jpg",2003,100 min,8.1,"[{'name': 'Animation'}, {'name': 'Adventure'}, {'name': 'Comedy'}]",,,,0,"380,843,261",,90.0,949565,Andrew Stanton,Lee Unkrich,Albert Brooks,Ellen DeGeneres,Alexander Gould,U
244,Catch Me If You Can,"Barely 21 yet, Frank is a skilled forger who has passed as a doctor, lawyer and pilot. FBI agent Carl becomes obsessed with tracking down the con man, who only revels in the pursuit.","https://m.media-amazon.com/images/M/MV5BMTY5MzYzNjc5NV5BMl5BanBnXkFtZTYwNTUyNTc2._V1_UX67_CR0,0,67,98_AL_.jpg",2002,141 min,8.1,"[{'name': 'Biography'}, {'name': 'Crime'}, {'name': 'Drama'}]",,,,0,"164,615,351",,75.0,832846,Steven Spielberg,Leonardo DiCaprio,Tom Hanks,Christopher Walken,Martin Sheen,A
245,Amores perros,"A horrific car accident connects three stories, each involving characters dealing with loss, regret, and life's harsh realities, all in the name of love.","https://m.media-amazon.com/images/M/MV5BMjQxMWJhMzMtMzllZi00NzMwLTllYjktNTcwZmU4ZmU3NTA0XkEyXkFqcGdeQXVyMTAzMDM4MjM0._V1_UY98_CR3,0,67,98_AL_.jpg",2000,154 min,8.1,"[{'name': 'Drama'}, {'name': 'Thriller'}]",,,,0,"5,383,834",,83.0,223741,Alejandro G. Iñárritu,Emilio Echevarría,Gael García Bernal,Goya Toledo,Álvaro Guerrero,A
246,"Monsters, Inc.","In order to power the city, monsters have to scare children so that they scream. However, the children are toxic to the monsters, and after a child gets through, 2 monsters realize things may not be what they think.","https://m.media-amazon.com/images/M/MV5BMTY1NTI0ODUyOF5BMl5BanBnXkFtZTgwNTEyNjQ0MDE@._V1_UX67_CR0,0,67,98_AL_.jpg",2001,92 min,8.1,"[{'name': 'Animation'}, {'name': 'Adventure'}, {'name': 'Comedy'}]",,,,0,"289,916,256",,79.0,815505,Pete Docter,David Silverman,Lee Unkrich,Billy Crystal,John Goodman,U
247,"Shin seiki Evangelion Gekijô-ban: Air/Magokoro wo, kimi ni",Concurrent theatrical ending of the TV series Shin seiki evangerion (1995).,"https://m.media-amazon.com/images/M/MV5BZjJhMThkNTQtNjkxNy00MDdjLTg4MWQtMTI2MmQ3MDVmODUzXkEyXkFqcGdeQXVyMTAwOTA3NzY3._V1_UY98_CR1,0,67,98_AL_.jpg",1997,87 min,8.1,"[{'name': 'Animation'}, {'name': 'Action'}, {'name': 'Drama'}]",,,,0,,,,38847,Hideaki Anno,Kazuya Tsurumaki,Megumi Ogata,Megumi Hayashibara,Yûko Miyamura,UA
248,Lagaan: Once Upon a Time in India,The people of a small village in Victorian India stake their future on a game of cricket against their ruthless British rulers.,"https://m.media-amazon.com/images/M/MV5BNDYxNWUzZmYtOGQxMC00MTdkLTkxOTctYzkyOGIwNWQxZjhmXkEyXkFqcGdeQXVyNjU0OTQ0OTY@._V1_UX67_CR0,0,67,98_AL_.jpg",2001,224 min,8.1,"[{'name': 'Adventure'}, {'name': 'Drama'}, {'name': 'Musical'}]",,,,0,"70,147",,84.0,105036,Ashutosh Gowariker,Aamir Khan,Raghuvir Yadav,Gracy Singh,Rachel Shelley,U
249,The Sixth Sense,A boy who communicates with spirits seeks the help of a disheartened child psychologist.,"https://m.media-amazon.com/images/M/MV5BMWM4NTFhYjctNzUyNi00NGMwLTk3NTYtMDIyNTZmMzRlYmQyXkEyXkFqcGdeQXVyMTAwMzUyOTc@._V1_UX67_CR0,0,67,98_AL_.jpg",1999,107 min,8.1,"[{'name': 'Drama'}, {'name': 'Mystery'}, {'name': 'Thriller'}]",,,,0,"293,506,292",,64.0,911573,M. Night Shyamalan,Bruce Willis,Haley Joel Osment,Toni Collette,Olivia Williams,A
250,La leggenda del pianista sull'oceano,"A baby boy, discovered in 1900 on an ocean liner, grows into a musical prodigy, never setting foot on land.","https://m.media-amazon.com/images/M/MV5BMzIwOTdmNjQtOWQ1ZS00ZWQ4LWIxYTMtOWFkM2NjODJiMGY4L2ltYWdlL2ltYWdlXkEyXkFqcGdeQXVyNTI4MjkwNjA@._V1_UX67_CR0,0,67,98_AL_.jpg",1998,169 min,8.1,"[{'name': 'Drama'}, {'name': 'Music'}, {'name': 'Romance'}]",,,,0,"259,127",,58.0,59020,Giuseppe Tornatore,Tim Roth,Pruitt Taylor Vince,Mélanie Thierry,Bill Nunn,U
251,The Truman Show,An insurance salesman discovers his whole life is actually a reality TV show.,"https://m.media-amazon.com/images/M/MV5BMDIzODcyY2EtMmY2MC00ZWVlLTgwMzAtMjQwOWUyNmJjNTYyXkEyXkFqcGdeQXVyNDk3NzU2MTQ@._V1_UX67_CR0,0,67,98_AL_.jpg",1998,103 min,8.1,"[{'name': 'Comedy'}, {'name': 'Drama'}]",,,,0,"125,618,201",,90.0,939631,Peter Weir,Jim Carrey,Ed Harris,Laura Linney,Noah Emmerich,U
252,"Crna macka, beli macor",Matko and his son Zare live on the banks of the Danube river and get by through hustling and basically doing anything to make a living. In order to pay off a business debt Matko agrees to marry off Zare to the sister of a local gangster.,"https://m.media-amazon.com/images/M/MV5BMmExZTZhN2QtMzg5Mi00Y2M5LTlmMWYtNTUzMzUwMGM2OGQ3XkEyXkFqcGdeQXVyNTA4NzY1MzY@._V1_UX67_CR0,0,67,98_AL_.jpg",1998,127 min,8.1,"[{'name': 'Comedy'}, {'name': 'Crime'}, {'name': 'Romance'}]",,,,0,"348,660",,73.0,50862,Emir Kusturica,Bajram Severdzan,Srdjan 'Zika' Todorovic,Branka Katic,Florijan Ajdini,R
253,The Big Lebowski,"Jeff ""The Dude"" Lebowski, mistaken for a millionaire of the same name, seeks restitution for his ruined rug and enlists his bowling buddies to help get it.","https://m.media-amazon.com/images/M/MV5BMTQ0NjUzMDMyOF5BMl5BanBnXkFtZTgwODA1OTU0MDE@._V1_UX67_CR0,0,67,98_AL_.jpg",1998,117 min,8.1,"[{'name': 'Comedy'}, {'name': 'Crime'}, {'name': 'Sport'}]",,,,0,"17,498,804",,71.0,732620,Joel Coen,Ethan Coen,Jeff Bridges,John Goodman,Julianne Moore,R
254,Fa yeung nin wah,"Two neighbors, a woman and a man, form a strong bond after both suspect extramarital activities of their spouses. However, they agree to keep their bond platonic so as not to commit similar wrongs.","https://m.media-amazon.com/images/M/MV5BYjZjODRlMjQtMjJlYy00ZDBjLTkyYTQtZGQxZTk5NzJhYmNmXkEyXkFqcGdeQXVyMTQxNzMzNDI@._V1_UY98_CR1,0,67,98_AL_.jpg",2000,98 min,8.1,"[{'name': 'Drama'}, {'name': 'Romance'}]",,,,0,"2,734,044",,85.0,124383,Kar-Wai Wong,Tony Chiu-Wai Leung,Maggie Cheung,Ping Lam Siu,Tung Cho 'Joe' Cheung,U
255,Trainspotting,"Renton, deeply immersed in the Edinburgh drug scene, tries to clean up and get out, despite the allure of the drugs and influence of friends.","https://m.media-amazon.com/images/M/MV5BMzA5Zjc3ZTMtMmU5YS00YTMwLWI4MWUtYTU0YTVmNjVmODZhXkEyXkFqcGdeQXVyNjU0OTQ0OTY@._V1_UX67_CR0,0,67,98_AL_.jpg",1996,93 min,8.1,[{'name': 'Drama'}],,,,0,"16,501,785",,83.0,634716,Danny Boyle,Ewan McGregor,Ewen Bremner,Jonny Lee Miller,Kevin McKidd,A
256,Fargo,Jerry Lundegaard's inept crime falls apart due to his and his henchmen's bungling and the persistent police work of the quite pregnant Marge Gunderson.,"https://m.media-amazon.com/images/M/MV5BNDJiZDgyZjctYmRjMS00ZjdkLTkwMTEtNGU1NDg3NDQ0Yzk1XkEyXkFqcGdeQXVyNzkwMjQ5NzM@._V1_UX67_CR0,0,67,98_AL_.jpg",1996,98 min,8.1,"[{'name': 'Crime'}, {'name': 'Drama'}, {'name': 'Thriller'}]",,,,0,"24,611,975",,85.0,617444,Joel Coen,Ethan Coen,William H. Macy,Frances McDormand,Steve Buscemi,A
257,Underground,"A group of Serbian socialists prepares for the war in a surreal underground filled by parties, tragedies, love and hate.","https://m.media-amazon.com/images/M/MV5BNzI4YTVmMWEtMWQ3MS00OGE1LWE5YjMtNjc4NWJmYjRmZTQyXkEyXkFqcGdeQXVyNTA4NzY1MzY@._V1_UY98_CR0,0,67,98_AL_.jpg",1995,170 min,8.1,"[{'name': 'Comedy'}, {'name': 'Drama'}, {'name': 'War'}]",,,,0,"171,082",,,55220,Emir Kusturica,Predrag 'Miki' Manojlovic,Lazar Ristovski,Mirjana Jokovic,Slavko Stimac,
258,La haine,24 hours in the lives of three young men in the French suburbs the day after a violent riot.,"https://m.media-amazon.com/images/M/MV5BNDNiOTA5YjktY2Q0Ni00ODgzLWE5MWItNGExOWRlYjY2MjBlXkEyXkFqcGdeQXVyNjQ2MjQ5NzM@._V1_UY98_CR1,0,67,98_AL_.jpg",1995,98 min,8.1,"[{'name': 'Crime'}, {'name': 'Drama'}]",,,,0,"309,811",,,150345,Mathieu Kassovitz,Vincent Cassel,Hubert Koundé,Saïd Taghmaoui,Abdel Ahmed Ghili,UA
259,Dilwale Dulhania Le Jayenge,"When Raj meets Simran in Europe, it isn't love at first sight but when Simran moves to India for an arranged marriage, love makes its presence felt.","https://m.media-amazon.com/images/M/MV5BYmNjYzRlM2YtZTZjZC00ODVmLTljZWMtODg1YmYyNDBiNzU3XkEyXkFqcGdeQXVyNTkzNDQ4ODc@._V1_UY98_CR3,0,67,98_AL_.jpg",1995,189 min,8.1,"[{'name': 'Drama'}, {'name': 'Romance'}]",,,,0,,,,63516,Aditya Chopra,Shah Rukh Khan,Kajol,Amrish Puri,Farida Jalal,U
260,Before Sunrise,"A young man and woman meet on a train in Europe, and wind up spending one evening together in Vienna. Unfortunately, both know that this will probably be their only night together.","https://m.media-amazon.com/images/M/MV5BZDdiZTAwYzAtMDI3Ni00OTRjLTkzN2UtMGE3MDMyZmU4NTU4XkEyXkFqcGdeQXVyNjU0OTQ0OTY@._V1_UX67_CR0,0,67,98_AL_.jpg",1995,101 min,8.1,"[{'name': 'Drama'}, {'name': 'Romance'}]",,,,0,"5,535,405",,77.0,272291,Richard Linklater,Ethan Hawke,Julie Delpy,Andrea Eckert,Hanno Pöschl,R
261,Trois couleurs: Rouge,A model discovers a retired judge is keen on invading people's privacy.,"https://m.media-amazon.com/images/M/MV5BYTg1MmNiMjItMmY4Yy00ZDQ3LThjMzYtZGQ0ZTQzNTdkMGQ1L2ltYWdlL2ltYWdlXkEyXkFqcGdeQXVyMTQxNzMzNDI@._V1_UX67_CR0,0,67,98_AL_.jpg",1994,99 min,8.1,"[{'name': 'Drama'}, {'name': 'Mystery'}, {'name': 'Romance'}]",,,,0,"4,043,686",,100.0,90729,Krzysztof Kieslowski,Irène Jacob,Jean-Louis Trintignant,Frédérique Feder,Jean-Pierre Lorit,U
262,Chung Hing sam lam,"Two melancholy Hong Kong policemen fall in love: one with a mysterious female underworld figure, the other with a beautiful and ethereal server at a late-night restaurant he frequents.","https://m.media-amazon.com/images/M/MV5BMGQ5MzljNzYtMDM1My00NmI0LThlYzQtMTg0ZmQ0MTk1YjkxXkEyXkFqcGdeQXVyNTAyODkwOQ@@._V1_UY98_CR1,0,67,98_AL_.jpg",1994,102 min,8.1,"[{'name': 'Comedy'}, {'name': 'Crime'}, {'name': 'Drama'}]",,,,0,"600,200",,77.0,63122,Kar-Wai Wong,Brigitte Lin,Takeshi Kaneshiro,Tony Chiu-Wai Leung,Faye Wong,U
263,Jurassic Park,A pragmatic paleontologist visiting an almost complete theme park is tasked with protecting a couple of kids after a power failure causes the park's cloned dinosaurs to run loose.,"https://m.media-amazon.com/images/M/MV5BMjM2MDgxMDg0Nl5BMl5BanBnXkFtZTgwNTM2OTM5NDE@._V1_UX67_CR0,0,67,98_AL_.jpg",1993,127 min,8.1,"[{'name': 'Action'}, {'name': 'Adventure'}, {'name': 'Sci-Fi'}]",,,,0,"402,453,882",,68.0,867615,Steven Spielberg,Sam Neill,Laura Dern,Jeff Goldblum,Richard Attenborough,UA
