id,title,overview,poster_path,release_date,runtime,vote_average,genres,backdrop_path,tagline,status,budget,revenue,homepage,popularity,vote_count,Director,Star1,Star2,Star3,Star4,certificate
743,Detachment,A substitute teacher who drifts from classroom to classroom finds a connection to the students and teachers during his latest assignment.,"https://m.media-amazon.com/images/M/MV5BMTM3NzQzMDA5Ml5BMl5BanBnXkFtZTcwODA5NTcyNw@@._V1_UY98_CR0,0,67,98_AL_.jpg",2011,98 min,7.7,[{'name': 'Drama'}],,,,0,"71,177",,52.0,77071,Tony Kaye,Adrien Brody,Christina Hendricks,Marcia Gay Harden,Lucy Liu,
744,Midnight in Paris,"While on a trip to Paris with his fiancée's family, a nostalgic screenwriter finds himself mysteriously going back to the 1920s every day at midnight.","https://m.media-amazon.com/images/M/MV5BMTM4NjY1MDQwMl5BMl5BanBnXkFtZTcwNTI3Njg3NA@@._V1_UX67_CR0,0,67,98_AL_.jpg",2011,96 min,7.7,"[{'name': 'Comedy'}, {'name': 'Fantasy'}, {'name': 'Romance'}]",,,,0,"56,816,662",,81.0,388089,Woody Allen,Owen Wilson,Rachel McAdams,Kathy Bates,Kurt Fuller,PG-13
745,The Lego Movie,"An ordinary LEGO construction worker, thought to be the prophesied as ""special"", is recruited to join a quest to stop an evil tyrant from gluing the LEGO universe into eternal stasis.","https://m.media-amazon.com/images/M/MV5BMTg4MDk1ODExN15BMl5BanBnXkFtZTgwNzIyNjg3MDE@._V1_UX67_CR0,0,67,98_AL_.jpg",2014,100 min,7.7,"[{'name': 'Animation'}, {'name': 'Action'}, {'name': 'Adventure'}]",,,,0,"257,760,692",,83.0,323982,Christopher Miller,Phil Lord,Chris Pratt,Will Ferrell,Elizabeth Banks,U
746,Gravity,Two astronauts work together to survive after an accident leaves them stranded in space.,"https://m.media-amazon.com/images/M/MV5BNjE5MzYwMzYxMF5BMl5BanBnXkFtZTcwOTk4MTk0OQ@@._V1_UX67_CR0,0,67,98_AL_.jpg",2013,91 min,7.7,"[{'name': 'Drama'}, {'name': 'Sci-Fi'}, {'name': 'Thriller'}]",,,,0,"274,092,705",,96.0,769145,Alfonso Cuarón,Sandra Bullock,George Clooney,Ed Harris,Orto Ignatiussen,UA
747,Star Trek Into Darkness,"After the crew of the Enterprise find an unstoppable force of terror from within their own organization, Captain Kirk leads a manhunt to a war-zone world to capture a one-man weapon of mass destruction.","https://m.media-amazon.com/images/M/MV5BMTk2NzczOTgxNF5BMl5BanBnXkFtZTcwODQ5ODczOQ@@._V1_UX67_CR0,0,67,98_AL_.jpg",2013,132 min,7.7,"[{'name': 'Action'}, {'name': 'Adventure'}, {'name': 'Sci-Fi'}]",,,,0,"228,778,661",,72.0,463188,J.J. Abrams,Chris Pine,Zachary Quinto,Zoe Saldana,Benedict Cumberbatch,UA
748,Beasts of No Nation,"A drama based on the experiences of Agu, a child soldier fighting in the civil war of an unnamed African country.","https://m.media-amazon.com/images/M/MV5BMTYwMzMzMDI0NF5BMl5BanBnXkFtZTgwNDQ3NjI3NjE@._V1_UX67_CR0,0,67,98_AL_.jpg",2015,137 min,7.7,"[{'name': 'Drama'}, {'name': 'War'}]",,,,0,"83,861",,79.0,73964,Cary Joji Fukunaga,Abraham Attah,Emmanuel Affadzi,Ricky Adelayitor,Andrew Adote,
749,The Social Network,"As Harvard student Mark Zuckerberg creates the social networking site that would become known as Facebook, he is sued by the twins who claimed he stole their idea, and by the co-founder who was later squeezed out of the business.","https://m.media-amazon.com/images/M/MV5BOGUyZDUxZjEtMmIzMC00MzlmLTg4MGItZWJmMzBhZjE0Mjc1XkEyXkFqcGdeQXVyMTMxODk2OTU@._V1_UX67_CR0,0,67,98_AL_.jpg",2010,120 min,7.7,"[{'name': 'Biography'}, {'name': 'Drama'}]",,,,0,"96,962,694",,95.0,624982,David Fincher,Jesse Eisenberg,Andrew Garfield,Justin Timberlake,Rooney Mara,UA
750,X: First Class,"In the 1960s, superpowered humans Charles Xavier and Erik Lensherr work together to find others like them, but Erik's vengeful pursuit of an ambitious mutant who ruined his life causes a schism to divide them.","https://m.media-amazon.com/images/M/MV5BMTg5OTMxNzk4Nl5BMl5BanBnXkFtZTcwOTk1MjAwNQ@@._V1_UX67_CR0,0,67,98_AL_.jpg",2011,131 min,7.7,"[{'name': 'Action'}, {'name': 'Adventure'}, {'name': 'Sci-Fi'}]",,,,0,"146,408,305",,65.0,645512,Matthew Vaughn,James McAvoy,Michael Fassbender,Jennifer Lawrence,Kevin Bacon,UA
751,The Hangover,"Three buddies wake up from a bachelor party in Las Vegas, with no memory of the previous night and the bachelor missing. They make their way around the city in order to find their friend before his wedding.","https://m.media-amazon.com/images/M/MV5BNGQwZjg5YmYtY2VkNC00NzliLTljYTctNzI5NmU3MjE2ODQzXkEyXkFqcGdeQXVyNzkwMjQ5NzM@._V1_UX67_CR0,0,67,98_AL_.jpg",2009,100 min,7.7,[{'name': 'Comedy'}],,,,0,"277,322,503",,73.0,717559,Todd Phillips,Zach Galifianakis,Bradley Cooper,Justin Bartha,Ed Helms,UA
752,Skyfall,"James Bond's loyalty to M is tested when her past comes back to haunt her. When MI6 comes under attack, 007 must track down and destroy the threat, no matter how personal the cost.","https://m.media-amazon.com/images/M/MV5BMWZiNjE2OWItMTkwNy00ZWQzLWI0NTgtMWE0NjNiYTljN2Q1XkEyXkFqcGdeQXVyNzAwMjYxMzA@._V1_UX67_CR0,0,67,98_AL_.jpg",2012,143 min,7.7,"[{'name': 'Action'}, {'name': 'Adventure'}, {'name': 'Thriller'}]",,,,0,"304,360,277",,81.0,630614,Sam Mendes,Daniel Craig,Javier Bardem,Naomie Harris,Judi Dench,UA
753,Silver Linings Playbook,"After a stint in a mental institution, former teacher Pat Solitano moves back in with his parents and tries to reconcile with his ex-wife. Things get more challenging when Pat meets Tiffany, a mysterious girl with problems of her own.","https://m.media-amazon.com/images/M/MV5BMTM2MTI5NzA3MF5BMl5BanBnXkFtZTcwODExNTc0OA@@._V1_UX67_CR0,0,67,98_AL_.jpg",2012,122 min,7.7,"[{'name': 'Comedy'}, {'name': 'Drama'}, {'name': 'Romance'}]",,,,0,"132,092,958",,81.0,661871,David O. Russell,Bradley Cooper,Jennifer Lawrence,Robert De Niro,Jacki Weaver,A
754,Argo,"Acting under the cover of a Hollywood producer scouting a location for a science fiction film, a CIA agent launches a dangerous operation to rescue six Americans in Tehran during the U.S. hostage crisis in Iran in 1979.","https://m.media-amazon.com/images/M/MV5BNzljNjY3MDYtYzc0Ni00YjU0LWIyNDUtNTE0ZDRiMGExMjZlXkEyXkFqcGdeQXVyMTMxODk2OTU@._V1_UX67_CR0,0,67,98_AL_.jpg",2012,120 min,7.7,"[{'name': 'Biography'}, {'name': 'Drama'}, {'name': 'Thriller'}]",,,,0,"136,025,503",,86.0,572581,Ben Affleck,Ben Affleck,Bryan Cranston,John Goodman,Alan Arkin,A
755,(500) Days of Summer,"An offbeat romantic comedy about a woman who doesn't believe true love exists, and the young man who falls for her.","https://m.media-amazon.com/images/M/MV5BMTk5MjM4OTU1OV5BMl5BanBnXkFtZTcwODkzNDIzMw@@._V1_UX67_CR0,0,67,98_AL_.jpg",2009,95 min,7.7,"[{'name': 'Comedy'}, {'name': 'Drama'}, {'name': 'Romance'}]",,,,0,"32,391,374",,76.0,472242,Marc Webb,Zooey Deschanel,Joseph Gordon-Levitt,Geoffrey Arend,Chloë Grace Moretz,UA
756,Harry Potter and the Deathly Hallows: Part 1,"As Harry, Ron, and Hermione race against time and evil to destroy the Horcruxes, they uncover the existence of the three most powerful objects in the wizarding world: the Deathly Hallows.","https://m.media-amazon.com/images/M/MV5BMTQ2OTE1Mjk0N15BMl5BanBnXkFtZTcwODE3MDAwNA@@._V1_UX67_CR0,0,67,98_AL_.jpg",2010,146 min,7.7,"[{'name': 'Adventure'}, {'name': 'Family'}, {'name': 'Fantasy'}]",,,,0,"295,983,305",,65.0,479120,David Yates,Daniel Radcliffe,Emma Watson,Rupert Grint,Bill Nighy,A
757,Gake no ue no Ponyo,"A five-year-old boy develops a relationship with Ponyo, a young goldfish princess who longs to become a human after falling in love with him.","https://m.media-amazon.com/images/M/MV5BOTc3YmM3N2QtODZkMC00ZDE5LThjMTQtYTljN2Y1YTYwYWJkXkEyXkFqcGdeQXVyODEzNjM5OTQ@._V1_UX67_CR0,0,67,98_AL_.jpg",2008,101 min,7.7,"[{'name': 'Animation'}, {'name': 'Adventure'}, {'name': 'Comedy'}]",,,,0,"15,090,400",,86.0,125317,Hayao Miyazaki,Cate Blanchett,Matt Damon,Liam Neeson,Tomoko Yamaguchi,U
758,Frost/Nixon,A dramatic retelling of the post-Watergate television interviews between British talk-show host David Frost and former president Richard Nixon.,"https://m.media-amazon.com/images/M/MV5BOTY4NTU2NTU4NF5BMl5BanBnXkFtZTcwNjE0OTc5MQ@@._V1_UX67_CR0,0,67,98_AL_.jpg",2008,122 min,7.7,"[{'name': 'Biography'}, {'name': 'Drama'}, {'name': 'History'}]",,,,0,"18,593,156",,80.0,103330,Ron Howard,Frank Langella,Michael Sheen,Kevin Bacon,Sam Rockwell,R
759,Papurika,"When a machine that allows therapists to enter their patients' dreams is stolen, all Hell breaks loose. Only a young female therapist, Paprika, can stop it.","https://m.media-amazon.com/images/M/MV5BNDliMTMxOWEtODM3Yi00N2QwLTg4YTAtNTE5YzBlNTA2NjhlXkEyXkFqcGdeQXVyNjE5MjUyOTM@._V1_UX67_CR0,0,67,98_AL_.jpg",2006,90 min,7.7,"[{'name': 'Animation'}, {'name': 'Drama'}, {'name': 'Fantasy'}]",,,,0,"881,302",,81.0,71379,Satoshi Kon,Megumi Hayashibara,Tôru Emori,Katsunosuke Hori,Tôru Furuya,U
760,Changeling,Grief-stricken mother Christine Collins (Angelina Jolie) takes on the L.A.P.D. to her own detriment when it tries to pass off an obvious impostor as her missing child.,"https://m.media-amazon.com/images/M/MV5BOTA1Mzg3NjIxNV5BMl5BanBnXkFtZTcwNzU2NTc5MQ@@._V1_UX67_CR0,0,67,98_AL_.jpg",2008,141 min,7.7,"[{'name': 'Biography'}, {'name': 'Crime'}, {'name': 'Drama'}]",,,,0,"35,739,802",,63.0,239203,Clint Eastwood,Angelina Jolie,Colm Feore,Amy Ryan,Gattlin Griffith,R
761,Flipped,Two eighth-graders start to have feelings for each other despite being total opposites.,"https://m.media-amazon.com/images/M/MV5BMTU2NjQ1Nzc4MF5BMl5BanBnXkFtZTcwNTM0NDk1Mw@@._V1_UX67_CR0,0,67,98_AL_.jpg",2010,90 min,7.7,"[{'name': 'Comedy'}, {'name': 'Drama'}, {'name': 'Romance'}]",,,,0,"1,752,214",,45.0,81446,Rob Reiner,Madeline Carroll,Callan McAuliffe,Rebecca De Mornay,Anthony Edwards,PG
762,Toki o kakeru shôjo,"A high-school girl named Makoto acquires the power to travel back in time, and decides to use it for her own personal benefits. Little does she know that she is affecting the lives of others just as much as she is her own.","https://m.media-amazon.com/images/M/MV5BMzA4ZGM1NjYtMjcxYS00MTdiLWJmNzEtMTUzODY0NDQ0YzUzXkEyXkFqcGdeQXVyMzYwMjQ3OTI@._V1_UY98_CR1,0,67,98_AL_.jpg",2006,98 min,7.7,"[{'name': 'Animation'}, {'name': 'Adventure'}, {'name': 'Comedy'}]",,,,0,,,,60368,Mamoru Hosoda,Riisa Naka,Takuya Ishida,Mitsutaka Itakura,Ayami Kakiuchi,U
763,Death Note: Desu nôto,"A battle between the world's two greatest minds begins when Light Yagami finds the Death Note, a notebook with the power to kill, and decides to rid the world of criminals.","https://m.media-amazon.com/images/M/MV5BZDNlNjEzMzQtZDM0MS00YzhiLTk0MGUtYTdmNDZiZGVjNTk0L2ltYWdlXkEyXkFqcGdeQXVyNTAyODkwOQ@@._V1_UY98_CR1,0,67,98_AL_.jpg",2006,126 min,7.7,"[{'name': 'Crime'}, {'name': 'Drama'}, {'name': 'Fantasy'}]",,,,0,,,,28630,Shûsuke Kaneko,Tatsuya Fujiwara,Ken'ichi Matsuyama,Asaka Seto,Yû Kashii,
764,This Is England,"A young boy becomes friends with a gang of skinheads. Friends soon become like family, and relationships will be pushed to the very limit.","https://m.media-amazon.com/images/M/MV5BMmE3OWZhZDYtOTBjMi00NDIwLTg1NWMtMjg0NjJmZWM4MjliL2ltYWdlXkEyXkFqcGdeQXVyNTAyODkwOQ@@._V1_UX67_CR0,0,67,98_AL_.jpg",2006,101 min,7.7,"[{'name': 'Crime'}, {'name': 'Drama'}]",,,,0,"327,919",,86.0,115576,Shane Meadows,Thomas Turgoose,Stephen Graham,Jo Hartley,Andrew Shim,
765,Ex Machina,A young programmer is selected to participate in a ground-breaking experiment in synthetic intelligence by evaluating the human qualities of a highly advanced humanoid A.I.,"https://m.media-amazon.com/images/M/MV5BMTUxNzc0OTIxMV5BMl5BanBnXkFtZTgwNDI3NzU2NDE@._V1_UX67_CR0,0,67,98_AL_.jpg",2014,108 min,7.7,"[{'name': 'Drama'}, {'name': 'Sci-Fi'}, {'name': 'Thriller'}]",,,,0,"25,442,958",,78.0,474141,Alex Garland,Alicia Vikander,Domhnall Gleeson,Oscar Isaac,Sonoya Mizuno,UA
766,Efter brylluppet,"A manager of an orphanage in India is sent to Copenhagen, Denmark, where he discovers a life-altering family secret.","https://m.media-amazon.com/images/M/MV5BMjIxODEyOTQ5Ml5BMl5BanBnXkFtZTcwNjE3NzI5Mw@@._V1_UY98_CR1,0,67,98_AL_.jpg",2006,120 min,7.7,[{'name': 'Drama'}],,,,0,"412,544",,78.0,32001,Susanne Bier,Mads Mikkelsen,Sidse Babett Knudsen,Rolf Lassgård,Neeral Mulchandani,R
767,The Last King of Scotland,Based on the events of the brutal Ugandan dictator Idi Amin's regime as seen by his personal physician during the 1970s.,"https://m.media-amazon.com/images/M/MV5BMjM1NTkxNjkzMl5BMl5BanBnXkFtZTgwNDgwMDAxMzE@._V1_UY98_CR1,0,67,98_AL_.jpg",2006,123 min,7.7,"[{'name': 'Biography'}, {'name': 'Drama'}, {'name': 'History'}]",,,,0,"17,605,861",,74.0,175355,Kevin Macdonald,James McAvoy,Forest Whitaker,Gillian Anderson,Kerry Washington,R
768,Zodiac,"In the late 1960s/early 1970s, a San Francisco cartoonist becomes an amateur detective obsessed with tracking down the Zodiac Killer, an unidentified individual who terrorizes Northern California with a killing spree.","https://m.media-amazon.com/images/M/MV5BN2UwNDc5NmEtNjVjZS00OTI5LWE5YjctMWM3ZjBiZGYwMGI2XkEyXkFqcGdeQXVyNzkwMjQ5NzM@._V1_UX67_CR0,0,67,98_AL_.jpg",2007,157 min,7.7,"[{'name': 'Crime'}, {'name': 'Drama'}, {'name': 'Mystery'}]",,,,0,"33,080,084",,78.0,466080,David Fincher,Jake Gyllenhaal,Robert Downey Jr.,Mark Ruffalo,Anthony Edwards,UA
769,Lucky Number Slevin,"A case of mistaken identity lands Slevin into the middle of a war being plotted by two of the city's most rival crime bosses. Under constant surveillance by Detective Brikowski and assassin Goodkat, he must get them before they get him.","https://m.media-amazon.com/images/M/MV5BZjczMWI1YWMtYTZjOS00ZDc5LWE2MWItMTY3ZGUxNzFkNjJmL2ltYWdlXkEyXkFqcGdeQXVyNjU0OTQ0OTY@._V1_UX67_CR0,0,67,98_AL_.jpg",2006,110 min,7.7,"[{'name': 'Action'}, {'name': 'Crime'}, {'name': 'Drama'}]",,,,0,"22,494,487",,53.0,299524,Paul McGuigan,Josh Hartnett,Ben Kingsley,Morgan Freeman,Lucy Liu,R
770,Joyeux Noël,"In December 1914, an unofficial Christmas truce on the Western Front allows soldiers from opposing sides of the First World War to gain insight into each other's way of life.","https://m.media-amazon.com/images/M/MV5BMTQyODczNjU3NF5BMl5BanBnXkFtZTcwNjQ0NDIzMQ@@._V1_UX67_CR0,0,67,98_AL_.jpg",2005,116 min,7.7,"[{'name': 'Drama'}, {'name': 'History'}, {'name': 'Music'}]",,,,0,"1,054,361",,70.0,28003,Christian Carion,Diane Kruger,Benno Fürmann,Guillaume Canet,Natalie Dessay,PG-13
771,Control,"A profile of Ian Curtis, the enigmatic singer of Joy Division whose personal, professional, and romantic troubles led him to commit suicide at the age of 23.","https://m.media-amazon.com/images/M/MV5BNTEzOTYwMTcxN15BMl5BanBnXkFtZTcwNTgyNjI1MQ@@._V1_UX67_CR0,0,67,98_AL_.jpg",2007,122 min,7.7,"[{'name': 'Biography'}, {'name': 'Drama'}, {'name': 'Music'}]",,,,0,"871,577",,78.0,61609,Anton Corbijn,Sam Riley,Samantha Morton,Craig Parkinson,Alexandra Maria Lara,R
772,Tangled,"The magically long-haired Rapunzel has spent her entire life in a tower, but now that a runaway thief has stumbled upon her, she is about to discover the world for the first time, and who she really is.","https://m.media-amazon.com/images/M/MV5BMTAxNDYxMjg0MjNeQTJeQWpwZ15BbWU3MDcyNTk2OTM@._V1_UX67_CR0,0,67,98_AL_.jpg",2010,100 min,7.7,"[{'name': 'Animation'}, {'name': 'Adventure'}, {'name': 'Comedy'}]",,,,0,"200,821,936",,71.0,405922,Nathan Greno,Byron Howard,Mandy Moore,Zachary Levi,Donna Murphy,U
773,Zwartboek,"In the Nazi-occupied Netherlands during World War II, a Jewish singer infiltrates the regional Gestapo headquarters for the Dutch resistance.","https://m.media-amazon.com/images/M/MV5BODFlNTI0ZWQtOTcxNC00OTc0LTkwZDUtMmNkM2I1ZWFlYzZkXkEyXkFqcGdeQXVyNTIzOTk5ODM@._V1_UY98_CR2,0,67,98_AL_.jpg",2006,145 min,7.7,"[{'name': 'Drama'}, {'name': 'Thriller'}, {'name': 'War'}]",,,,0,"4,398,392",,71.0,72643,Paul Verhoeven,Carice van Houten,Sebastian Koch,Thom Hoffman,Halina Reijn,R
774,Brokeback Mountain,"The story of a forbidden and secretive relationship between two cowboys, and their lives over the years.","https://m.media-amazon.com/images/M/MV5BMTY5NTAzNTc1NF5BMl5BanBnXkFtZTYwNDY4MDc3._V1_UX67_CR0,0,67,98_AL_.jpg",2005,134 min,7.7,"[{'name': 'Drama'}, {'name': 'Romance'}]",,,,0,"83,043,761",,87.0,323103,Ang Lee,Jake Gyllenhaal,Heath Ledger,Michelle Williams,Randy Quaid,A
775,3:10 to Yuma,A small-time rancher agrees to hold a captured outlaw who's awaiting a train to go to court in Yuma. A battle of wills ensues as the outlaw tries to psych out the rancher.,"https://m.media-amazon.com/images/M/MV5BODE0NTcxNTQzNF5BMl5BanBnXkFtZTcwMzczOTIzMw@@._V1_UX67_CR0,0,67,98_AL_.jpg",2007,122 min,7.7,"[{'name': 'Action'}, {'name': 'Crime'}, {'name': 'Drama'}]",,,,0,"53,606,916",,76.0,288797,James Mangold,Russell Crowe,Christian Bale,Ben Foster,Logan Lerman,A
776,Crash,"Los Angeles citizens with vastly separate lives collide in interweaving stories of race, loss and redemption.","https://m.media-amazon.com/images/M/MV5BOTk1OTA1MjIyNV5BMl5BanBnXkFtZTcwODQxMTkyMQ@@._V1_UX67_CR0,0,67,98_AL_.jpg",2004,112 min,7.7,"[{'name': 'Crime'}, {'name': 'Drama'}, {'name': 'Thriller'}]",,,,0,"54,580,300",,66.0,419483,Paul Haggis,Don Cheadle,Sandra Bullock,Thandie Newton,Karina Arroyave,UA
777,Kung fu,"In Shanghai, China in the 1940s, a wannabe gangster aspires to join the notorious ""Axe Gang"" while residents of a housing complex exhibit extraordinary powers in defending their turf.","https://m.media-amazon.com/images/M/MV5BMjZiOTNlMzYtZWYwZS00YWJjLTk5NDgtODkwNjRhMDI0MjhjXkEyXkFqcGdeQXVyMjgyNjk3MzE@._V1_UY98_CR1,0,67,98_AL_.jpg",2004,99 min,7.7,"[{'name': 'Action'}, {'name': 'Comedy'}, {'name': 'Fantasy'}]",,,,0,"17,108,591",,78.0,127250,Stephen Chow,Stephen Chow,Wah Yuen,Qiu Yuen,Siu-Lung Leung,UA
778,The Bourne Supremacy,"When Jason Bourne is framed for a CIA operation gone awry, he is forced to resume his former life as a trained assassin to survive.","https://m.media-amazon.com/images/M/MV5BYTIyMDFmMmItMWQzYy00MjBiLTg2M2UtM2JiNDRhOWE4NjBhXkEyXkFqcGdeQXVyNjU0OTQ0OTY@._V1_UX67_CR0,0,67,98_AL_.jpg",2004,108 min,7.7,"[{'name': 'Action'}, {'name': 'Mystery'}, {'name': 'Thriller'}]",,,,0,"176,241,941",,73.0,434841,Paul Greengrass,Matt Damon,Franka Potente,Joan Allen,Brian Cox,A
779,The Machinist,An industrial worker who hasn't slept in a year begins to doubt his own sanity.,"https://m.media-amazon.com/images/M/MV5BNjk1NzBlY2YtNjJmNi00YTVmLWI2OTgtNDUxNDE5NjUzZmE0XkEyXkFqcGdeQXVyNTc1NTQxODI@._V1_UX67_CR0,0,67,98_AL_.jpg",2004,101 min,7.7,"[{'name': 'Drama'}, {'name': 'Thriller'}]",,,,0,"1,082,715",,61.0,358432,Brad Anderson,Christian Bale,Jennifer Jason Leigh,Aitana Sánchez-Gijón,John Sharian,R
780,Ray,"The story of the life and career of the legendary rhythm and blues musician Ray Charles, from his humble beginnings in the South, where he went blind at age seven, to his meteoric rise to stardom during the 1950s and 1960s.","https://m.media-amazon.com/images/M/MV5BMTQxNDQwNjQzOV5BMl5BanBnXkFtZTcwNTQxNDYyMQ@@._V1_UX67_CR0,0,67,98_AL_.jpg",2004,152 min,7.7,"[{'name': 'Biography'}, {'name': 'Drama'}, {'name': 'Music'}]",,,,0,"75,331,600",,73.0,138356,Taylor Hackford,Jamie Foxx,Regina King,Kerry Washington,Clifton Powell,A
781,Lost in Translation,A faded movie star and a neglected young woman form an unlikely bond after crossing paths in Tokyo.,"https://m.media-amazon.com/images/M/MV5BMTI2NDI5ODk4N15BMl5BanBnXkFtZTYwMTI3NTE3._V1_UX67_CR0,0,67,98_AL_.jpg",2003,102 min,7.7,"[{'name': 'Comedy'}, {'name': 'Drama'}]",,,,0,"44,585,453",,89.0,415074,Sofia Coppola,Bill Murray,Scarlett Johansson,Giovanni Ribisi,Anna Faris,UA
782,Harry Potter and the Goblet of Fire,"Harry Potter finds himself competing in a hazardous tournament between rival schools of magic, but he is distracted by recurring nightmares.","https://m.media-amazon.com/images/M/MV5BMTI1NDMyMjExOF5BMl5BanBnXkFtZTcwOTc4MjQzMQ@@._V1_UX67_CR0,0,67,98_AL_.jpg",2005,157 min,7.7,"[{'name': 'Adventure'}, {'name': 'Family'}, {'name': 'Fantasy'}]",,,,0,"290,013,036",,81.0,548619,Mike Newell,Daniel Radcliffe,Emma Watson,Rupert Grint,Eric Sykes,UA
783,Man on Fire,"In Mexico City, a former CIA operative swears vengeance on those who committed an unspeakable act against the family he was hired to protect.","https://m.media-amazon.com/images/M/MV5BODFlMmEwMDgtYjhmZi00ZTE5LTk2NWQtMWE1Y2M0NjkzOGYxXkEyXkFqcGdeQXVyNjU0OTQ0OTY@._V1_UX67_CR0,0,67,98_AL_.jpg",2004,146 min,7.7,"[{'name': 'Action'}, {'name': 'Crime'}, {'name': 'Drama'}]",,,,0,"77,911,774",,47.0,329592,Tony Scott,Denzel Washington,Christopher Walken,Dakota Fanning,Radha Mitchell,UA
784,Coraline,"An adventurous 11-year-old girl finds another world that is a strangely idealized version of her frustrating home, but it has sinister secrets.","https://m.media-amazon.com/images/M/MV5BMzQxNjM5NzkxNV5BMl5BanBnXkFtZTcwMzg5NDMwMg@@._V1_UX67_CR0,0,67,98_AL_.jpg",2009,100 min,7.7,"[{'name': 'Animation'}, {'name': 'Drama'}, {'name': 'Family'}]",,,,0,"75,286,229",,80.0,197761,Henry Selick,Dakota Fanning,Teri Hatcher,John Hodgman,Jennifer Saunders,U
785,The Last Samurai,An American military advisor embraces the Samurai culture he was hired to destroy after he is captured in battle.,"https://m.media-amazon.com/images/M/MV5BMzkyNzQ1Mzc0NV5BMl5BanBnXkFtZTcwODg3MzUzMw@@._V1_UX67_CR0,0,67,98_AL_.jpg",2003,154 min,7.7,"[{'name': 'Action'}, {'name': 'Drama'}]",,,,0,"111,110,575",,55.0,400049,Edward Zwick,Tom Cruise,Ken Watanabe,Billy Connolly,William Atherton,UA
786,The Magdalene Sisters,Three young Irish women struggle to maintain their spirits while they endure dehumanizing abuse as inmates of a Magdalene Sisters Asylum.,"https://m.media-amazon.com/images/M/MV5BMTI2NzU1NTc1NF5BMl5BanBnXkFtZTcwOTQ1MjAwMQ@@._V1_UX67_CR0,0,67,98_AL_.jpg",2002,114 min,7.7,[{'name': 'Drama'}],,,,0,"4,890,878",,83.0,25938,Peter Mullan,Eileen Walsh,Dorothy Duffy,Nora-Jane Noone,Anne-Marie Duff,R
787,Good Bye Lenin!,"In 1990, to protect his fragile mother from a fatal shock after a long coma, a young man must keep her from learning that her beloved nation of East Germany as she knew it has disappeared.","https://m.media-amazon.com/images/M/MV5BMTI0MTg4NzI3M15BMl5BanBnXkFtZTcwOTE0MTUyMQ@@._V1_UY98_CR0,0,67,98_AL_.jpg",2003,121 min,7.7,"[{'name': 'Comedy'}, {'name': 'Drama'}, {'name': 'Romance'}]",,,,0,"4,064,200",,68.0,137981,Wolfgang Becker,Daniel Brühl,Katrin Saß,Chulpan Khamatova,Florian Lukas,R
788,In America,A family of Irish immigrants adjust to life on the mean streets of Hell's Kitchen while also grieving the death of a child.,"https://m.media-amazon.com/images/M/MV5BOGY1YmUzN2MtNDQ3NC00Nzc4LWI5M2EtYzUwMGQ4NWM4NjE1XkEyXkFqcGdeQXVyMTQxNzMzNDI@._V1_UY98_CR0,0,67,98_AL_.jpg",2002,105 min,7.7,[{'name': 'Drama'}],,,,0,"15,539,266",,76.0,40403,Jim Sheridan,Paddy Considine,Samantha Morton,Djimon Hounsou,Sarah Bolger,PG-13
789,I Am Sam,A mentally handicapped man fights for custody of his 7-year-old daughter and in the process teaches his cold-hearted lawyer the value of love and family.,"https://m.media-amazon.com/images/M/MV5BYzEyNzc0NjctZjJiZC00MWI1LWJlOTMtYWZkZDAzNzQ0ZDNkXkEyXkFqcGdeQXVyMTQxNzMzNDI@._V1_UX67_CR0,0,67,98_AL_.jpg",2001,132 min,7.7,[{'name': 'Drama'}],,,,0,"40,311,852",,28.0,142863,Jessie Nelson,Sean Penn,Michelle Pfeiffer,Dakota Fanning,Dianne Wiest,PG-13
790,Adaptation.,A lovelorn screenwriter becomes desperate as he tries and fails to adapt 'The Orchid Thief' by Susan Orlean for the screen.,"https://m.media-amazon.com/images/M/MV5BZjIwZWU0ZDItNzBlNS00MDIwLWFlZjctZTJjODdjZWYxNzczL2ltYWdlXkEyXkFqcGdeQXVyMTMxODk2OTU@._V1_UX67_CR0,0,67,98_AL_.jpg",2002,115 min,7.7,"[{'name': 'Comedy'}, {'name': 'Drama'}]",,,,0,"22,245,861",,83.0,178565,Spike Jonze,Nicolas Cage,Meryl Streep,Chris Cooper,Tilda Swinton,R
791,Black Hawk Down,160 elite U.S. soldiers drop into Somalia to capture two top lieutenants of a renegade warlord and find themselves in a desperate battle with a large force of heavily-armed Somalis.,"https://m.media-amazon.com/images/M/MV5BYWMwMzQxZjQtODM1YS00YmFiLTk1YjQtNzNiYWY1MDE4NTdiXkEyXkFqcGdeQXVyNDYyMDk5MTU@._V1_UX67_CR0,0,67,98_AL_.jpg",2001,144 min,7.7,"[{'name': 'Drama'}, {'name': 'History'}, {'name': 'War'}]",,,,0,"108,638,745",,74.0,364254,Ridley Scott,Josh Hartnett,Ewan McGregor,Tom Sizemore,Eric Bana,A
792,Road to Perdition,"A mob enforcer's son witnesses a murder, forcing him and his father to take to the road, and his father down a path of redemption and revenge.","https://m.media-amazon.com/images/M/MV5BNjcxMmQ0MmItYTkzYy00MmUyLTlhOTQtMmJmNjE3MDMwYjdlXkEyXkFqcGdeQXVyNzkwMjQ5NzM@._V1_UX67_CR0,0,67,98_AL_.jpg",2002,117 min,7.7,"[{'name': 'Crime'}, {'name': 'Drama'}, {'name': 'Thriller'}]",,,,0,"104,454,762",,72.0,246840,Sam Mendes,Tom Hanks,Tyler Hoechlin,Rob Maxey,Liam Aiken,A
793,Das Experiment,"For two weeks, 20 male participants are hired to play prisoners and guards in a prison. The ""prisoners"" have to follow seemingly mild rules, and the ""guards"" are told to retain order without using physical violence.","https://m.media-amazon.com/images/M/MV5BNThiMDc1YjUtYmE3Zi00MTM1LTkzM2MtNjdlNzQ4ZDlmYjRmXkEyXkFqcGdeQXVyMTQxNzMzNDI@._V1_UY98_CR1,0,67,98_AL_.jpg",2001,120 min,7.7,"[{'name': 'Drama'}, {'name': 'Thriller'}]",,,,0,"141,072",,60.0,90842,Oliver Hirschbiegel,Moritz Bleibtreu,Christian Berkel,Oliver Stokowski,Wotan Wilke Möhring,R
794,Billy Elliot,A talented young boy becomes torn between his unexpected love of dance and the disintegration of his family.,"https://m.media-amazon.com/images/M/MV5BNGY3NWYwNzctNWU5Yi00ZjljLTgyNDgtZjNhZjRlNjc0ZTU1XkEyXkFqcGdeQXVyMTQxNzMzNDI@._V1_UX67_CR0,0,67,98_AL_.jpg",2000,110 min,7.7,"[{'name': 'Drama'}, {'name': 'Music'}]",,,,0,"21,995,263",,74.0,126770,Stephen Daldry,Jamie Bell,Julie Walters,Jean Heywood,Jamie Draven,R
